{
  "contract_version": "strategy-draft/v1",
  "objective": "提升新品在研发负责人人群中的认知",
  "audience": {
    "primary": "制造企业研发负责人",
    "insights": ["重视可验证的数据和真实落地案例"]
  },
  "proposition": "用可验证的效率提升缩短研发周期",
  "channel_strategy": [
    {
      "platform": "xiaohongshu",
      "role": "建立专业认知并承接搜索决策",
      "formats": ["图文笔记", "清单型笔记"]
    }
  ],
  "creative_recommendations": ["用研发流程前后对比建立可信度"],
  "constraints": ["不得使用无法证实的效果承诺"],
  "budget_and_cadence": {
    "budget": "CNY 100000",
    "cadence": "两周测试、每周复盘"
  },
  "experiment_matrix": [
    {
      "hypothesis": "数据证据开篇能提高有效阅读",
      "variable": "首屏表达",
      "metric": "阅读完成率"
    }
  ],
  "measurement": ["有效线索数"],
  "assumptions_and_gaps": [],
  "lineage": {
    "brief_id": "brief_01",
    "brief_version": 1,
    "project_context_version": 3,
    "skill_versions": {
      "strategy.strategy.generate": "v1.0.0",
      "channel.xiaohongshu": "v1.0.0"
    }
  }
}
